{
  "protocol_version": 1,
  "request_id": "aaaaaaaa-aaaa-4aaa-8aaa-aaaaaaaaaaa3",
  "server_time": "2026-08-13T17:11:40.000Z",
  "server_hlc": {
    "physical_ms": 1786641100000,
    "logical": 0,
    "actor_id": "99999999-9999-4999-8999-999999999999"
  },
  "accepted_capability_hash": "yDT7H257uKE2R3D2Okc2g7PnDNGlvHnA2XzDv3AzfeA",
  "telemetry": {
    "accepted_chunks": [
      {
        "boot_sequence": 42,
        "chunk_sequence": 8,
        "through_point_sequence": 2,
        "accepted_point_count": 3,
        "content_sha256": "_jihWuBz7CuQ7kZODIzPxZJZIgUGDhufAOdLFvZNFlc"
      }
    ],
    "rejected_chunks": [],
    "accepted_summary_ids": ["77777777-7777-4777-8777-777777777777"],
    "rejected_summaries": [],
    "accepted_loss_marker_ids": [],
    "rejected_loss_markers": []
  },
  "configuration": {
    "outcomes": [
      {
        "mutation_id": "66666666-6666-4666-8666-666666666666",
        "resource_key": "brightness",
        "disposition": "winning",
        "replayed": false,
        "ordering": "authored",
        "server_version": 18,
        "accepted_hlc": {
          "physical_ms": 1786641000123,
          "logical": 0,
          "actor_id": "11111111-1111-4111-8111-111111111111"
        },
        "error_code": null
      }
    ],
    "desired_resources": [
      {
        "resource_key": "brightness",
        "resource_schema": 1,
        "server_version": 18,
        "accepted_hlc": {
          "physical_ms": 1786641000123,
          "logical": 0,
          "actor_id": "11111111-1111-4111-8111-111111111111"
        },
        "body": {"brightness": 96},
        "body_sha256": "qHIb69FUgaOyv3H4RMfHX8vtlwreJSvnUEiF6YMbFvk"
      }
    ]
  },
  "next_sync_after_seconds": 900
}
